{
  "dataset": "hpm-taxonomy",
  "history": [],
  "method": {
    "automationMapIndependent": true,
    "definitionsDoNotInflateCounts": true,
    "packageUnit": "Each current HPM package is counted at most once per term.",
    "percentageDenominator": 956,
    "remoteContentExecuted": false
  },
  "metrics": {
    "categories": [
      {
        "appPackageCount": 37,
        "driverPackageCount": 165,
        "mixedPackageCount": 15,
        "name": "Control",
        "packageCount": 191,
        "percent": 19.98,
        "rank": 2,
        "unused": false
      },
      {
        "appPackageCount": 71,
        "driverPackageCount": 66,
        "mixedPackageCount": 32,
        "name": "Convenience",
        "packageCount": 106,
        "percent": 11.09,
        "rank": 3,
        "unused": false
      },
      {
        "appPackageCount": 158,
        "driverPackageCount": 385,
        "mixedPackageCount": 135,
        "name": "Integrations",
        "packageCount": 413,
        "percent": 43.2,
        "rank": 1,
        "unused": false
      },
      {
        "appPackageCount": 9,
        "driverPackageCount": 12,
        "mixedPackageCount": 3,
        "name": "Notifications",
        "packageCount": 18,
        "percent": 1.88,
        "rank": 6,
        "unused": false
      },
      {
        "appPackageCount": 17,
        "driverPackageCount": 31,
        "mixedPackageCount": 12,
        "name": "Security",
        "packageCount": 36,
        "percent": 3.77,
        "rank": 5,
        "unused": false
      },
      {
        "appPackageCount": 62,
        "driverPackageCount": 59,
        "mixedPackageCount": 17,
        "name": "Utility",
        "packageCount": 106,
        "percent": 11.09,
        "rank": 3,
        "unused": false
      }
    ],
    "tags": [
      {
        "appPackageCount": 11,
        "driverPackageCount": 36,
        "mixedPackageCount": 6,
        "name": "Alarm Systems",
        "packageCount": 41,
        "percent": 4.29,
        "rank": 16,
        "unused": false
      },
      {
        "appPackageCount": 17,
        "driverPackageCount": 32,
        "mixedPackageCount": 15,
        "name": "Appliances",
        "packageCount": 35,
        "percent": 3.66,
        "rank": 19,
        "unused": false
      },
      {
        "appPackageCount": 20,
        "driverPackageCount": 15,
        "mixedPackageCount": 11,
        "name": "Automations & Groups",
        "packageCount": 24,
        "percent": 2.51,
        "rank": 24,
        "unused": false
      },
      {
        "appPackageCount": 3,
        "driverPackageCount": 3,
        "mixedPackageCount": 2,
        "name": "Bathroom",
        "packageCount": 4,
        "percent": 0.42,
        "rank": 44,
        "unused": false
      },
      {
        "appPackageCount": 11,
        "driverPackageCount": 39,
        "mixedPackageCount": 5,
        "name": "Buttons",
        "packageCount": 46,
        "percent": 4.81,
        "rank": 14,
        "unused": false
      },
      {
        "appPackageCount": 0,
        "driverPackageCount": 3,
        "mixedPackageCount": 0,
        "name": "Cameras",
        "packageCount": 3,
        "percent": 0.31,
        "rank": 46,
        "unused": false
      },
      {
        "appPackageCount": 3,
        "driverPackageCount": 3,
        "mixedPackageCount": 3,
        "name": "Cleaning Devices",
        "packageCount": 3,
        "percent": 0.31,
        "rank": 46,
        "unused": false
      },
      {
        "appPackageCount": 32,
        "driverPackageCount": 58,
        "mixedPackageCount": 28,
        "name": "Climate Control",
        "packageCount": 65,
        "percent": 6.8,
        "rank": 12,
        "unused": false
      },
      {
        "appPackageCount": 56,
        "driverPackageCount": 84,
        "mixedPackageCount": 50,
        "name": "Cloud",
        "packageCount": 90,
        "percent": 9.41,
        "rank": 7,
        "unused": false
      },
      {
        "appPackageCount": 23,
        "driverPackageCount": 32,
        "mixedPackageCount": 17,
        "name": "Dashboards",
        "packageCount": 38,
        "percent": 3.97,
        "rank": 17,
        "unused": false
      },
      {
        "appPackageCount": 17,
        "driverPackageCount": 29,
        "mixedPackageCount": 11,
        "name": "Doors & Windows",
        "packageCount": 35,
        "percent": 3.66,
        "rank": 19,
        "unused": false
      },
      {
        "appPackageCount": 14,
        "driverPackageCount": 63,
        "mixedPackageCount": 10,
        "name": "Energy Monitoring",
        "packageCount": 68,
        "percent": 7.11,
        "rank": 11,
        "unused": false
      },
      {
        "appPackageCount": 7,
        "driverPackageCount": 19,
        "mixedPackageCount": 7,
        "name": "Garage Doors",
        "packageCount": 19,
        "percent": 1.99,
        "rank": 28,
        "unused": false
      },
      {
        "appPackageCount": 1,
        "driverPackageCount": 1,
        "mixedPackageCount": 1,
        "name": "HDMI",
        "packageCount": 1,
        "percent": 0.1,
        "rank": 50,
        "unused": false
      },
      {
        "appPackageCount": 5,
        "driverPackageCount": 6,
        "mixedPackageCount": 5,
        "name": "Health & Fitness",
        "packageCount": 6,
        "percent": 0.63,
        "rank": 41,
        "unused": false
      },
      {
        "appPackageCount": 6,
        "driverPackageCount": 21,
        "mixedPackageCount": 6,
        "name": "IR & RF",
        "packageCount": 21,
        "percent": 2.2,
        "rank": 27,
        "unused": false
      },
      {
        "appPackageCount": 8,
        "driverPackageCount": 14,
        "mixedPackageCount": 7,
        "name": "Irrigation",
        "packageCount": 15,
        "percent": 1.57,
        "rank": 30,
        "unused": false
      },
      {
        "appPackageCount": 1,
        "driverPackageCount": 1,
        "mixedPackageCount": 1,
        "name": "KVM",
        "packageCount": 1,
        "percent": 0.1,
        "rank": 50,
        "unused": false
      },
      {
        "appPackageCount": 43,
        "driverPackageCount": 99,
        "mixedPackageCount": 38,
        "name": "LAN",
        "packageCount": 106,
        "percent": 11.09,
        "rank": 5,
        "unused": false
      },
      {
        "appPackageCount": 50,
        "driverPackageCount": 134,
        "mixedPackageCount": 21,
        "name": "Lights & Switches",
        "packageCount": 168,
        "percent": 17.57,
        "rank": 1,
        "unused": false
      },
      {
        "appPackageCount": 16,
        "driverPackageCount": 16,
        "mixedPackageCount": 7,
        "name": "Locks",
        "packageCount": 25,
        "percent": 2.62,
        "rank": 23,
        "unused": false
      },
      {
        "appPackageCount": 1,
        "driverPackageCount": 7,
        "mixedPackageCount": 0,
        "name": "Matter",
        "packageCount": 9,
        "percent": 0.94,
        "rank": 37,
        "unused": false
      },
      {
        "appPackageCount": 26,
        "driverPackageCount": 71,
        "mixedPackageCount": 19,
        "name": "Misc. Devices",
        "packageCount": 79,
        "percent": 8.26,
        "rank": 9,
        "unused": false
      },
      {
        "appPackageCount": 59,
        "driverPackageCount": 105,
        "mixedPackageCount": 26,
        "name": "Monitoring",
        "packageCount": 141,
        "percent": 14.75,
        "rank": 2,
        "unused": false
      },
      {
        "appPackageCount": 10,
        "driverPackageCount": 16,
        "mixedPackageCount": 5,
        "name": "Motion Control",
        "packageCount": 22,
        "percent": 2.3,
        "rank": 26,
        "unused": false
      },
      {
        "appPackageCount": 5,
        "driverPackageCount": 10,
        "mixedPackageCount": 5,
        "name": "MQTT",
        "packageCount": 10,
        "percent": 1.05,
        "rank": 36,
        "unused": false
      },
      {
        "appPackageCount": 26,
        "driverPackageCount": 36,
        "mixedPackageCount": 26,
        "name": "Multimedia",
        "packageCount": 36,
        "percent": 3.77,
        "rank": 18,
        "unused": false
      },
      {
        "appPackageCount": 12,
        "driverPackageCount": 20,
        "mixedPackageCount": 9,
        "name": "Multi Sensors",
        "packageCount": 24,
        "percent": 2.51,
        "rank": 24,
        "unused": false
      },
      {
        "appPackageCount": 24,
        "driverPackageCount": 30,
        "mixedPackageCount": 10,
        "name": "Notifications",
        "packageCount": 44,
        "percent": 4.6,
        "rank": 15,
        "unused": false
      },
      {
        "appPackageCount": 5,
        "driverPackageCount": 9,
        "mixedPackageCount": 5,
        "name": "Pets & Animals",
        "packageCount": 9,
        "percent": 0.94,
        "rank": 37,
        "unused": false
      },
      {
        "appPackageCount": 10,
        "driverPackageCount": 12,
        "mixedPackageCount": 8,
        "name": "Pools & Spas",
        "packageCount": 14,
        "percent": 1.46,
        "rank": 33,
        "unused": false
      },
      {
        "appPackageCount": 18,
        "driverPackageCount": 54,
        "mixedPackageCount": 16,
        "name": "Presence & Location",
        "packageCount": 56,
        "percent": 5.86,
        "rank": 13,
        "unused": false
      },
      {
        "appPackageCount": 1,
        "driverPackageCount": 4,
        "mixedPackageCount": 1,
        "name": "Relays",
        "packageCount": 4,
        "percent": 0.42,
        "rank": 44,
        "unused": false
      },
      {
        "appPackageCount": 1,
        "driverPackageCount": 15,
        "mixedPackageCount": 1,
        "name": "Repeaters & Extenders",
        "packageCount": 15,
        "percent": 1.57,
        "rank": 30,